{
  "$schema": "./scope-topology.schema.json",
  "version": 2,
  "provisioning": {
    "appPrefix": "Demo",
    "resourceNames": {
      "Super Banking API":           "Demo API",
      "Super Banking MCP Server":    "Demo MCP Server",
      "Super Banking MCP Gateway":   "Demo MCP Gateway",
      "Super Banking Agent Gateway": "Demo Agent Gateway"
    },
    "appNames": {
      "Super Banking User App":      "Demo User App",
      "Super Banking Admin App":     "Demo Admin App",
      "Super Banking MCP Server":    "Demo MCP Server",
      "Super Banking MCP Gateway":   "Demo MCP Gateway",
      "Super Banking MCP Exchanger": "Demo MCP Exchanger",
      "Super Banking AI Agent":      "Demo AI Agent",
      "Super Banking Agent":         "Demo Agent",
      "Super Banking Worker":        "Demo Worker"
    }
  },
  "scopes": {
    "read":              { "description": "Read accounts, balances, transactions", "riskLevel": "low",    "resource": "Super Banking API", "category": "data" },
    "write":             { "description": "Write operations (deposit/withdrawal/transfer)", "riskLevel": "high", "resource": "Super Banking API", "category": "data" },
    "transfer":          { "description": "Execute fund transfers", "riskLevel": "high", "resource": "Super Banking API", "category": "data" },
    "accounts:read":     { "description": "Read account information and balances", "riskLevel": "low", "resource": "Super Banking API", "category": "data" },
    "transactions:read": { "description": "Read transaction history and details", "riskLevel": "low", "resource": "Super Banking API", "category": "data" },
    "mortgage:read":     { "description": "Read mortgage/feature-specific data (banking vertical)", "riskLevel": "low", "resource": "Super Banking API", "category": "feature" },
    "ai:agent:read":     { "description": "Agent invocation permission", "riskLevel": "medium", "resource": "Super Banking API", "category": "agent" },
    "mcp:invoke":        { "description": "Invoke MCP tools via the gateway (RFC 8693 exchange)", "riskLevel": "medium", "resource": "Super Banking MCP Server", "category": "infra" },
    "agent:invoke":      { "description": "Invoke the Agent Gateway (Two-Exchange Step 1 audience)", "riskLevel": "medium", "resource": "Super Banking Agent Gateway", "category": "infra" },
    "ai_agent":          { "description": "AI agent identity", "riskLevel": "medium", "resource": "Super Banking API", "category": "ai" },
    "admin:read":        { "description": "Read access to administrative data", "riskLevel": "medium", "resource": "Super Banking API", "category": "admin" },
    "admin:write":       { "description": "Write access to administrative operations", "riskLevel": "high", "resource": "Super Banking API", "category": "admin" },
    "admin:delete":      { "description": "Delete operations for administrative tasks", "riskLevel": "critical", "resource": "Super Banking API", "category": "admin" },
    "users:read":        { "description": "Read access to user management data", "riskLevel": "medium", "resource": "Super Banking API", "category": "admin" },
    "users:manage":      { "description": "Full user management capabilities", "riskLevel": "high", "resource": "Super Banking API", "category": "admin" }
  },
  "resources": {
    "Super Banking API": {
      "uri": "enduser.ping.demo",
      "scopes": ["read", "write", "transfer", "accounts:read", "transactions:read", "mortgage:read", "ai:agent:read", "ai_agent", "admin:read", "admin:write", "admin:delete", "users:read", "users:manage"]
    },
    "Super Banking MCP Server": {
      "uri": "mcpserver.ping.demo",
      "scopes": ["mcp:invoke"],
      "mirroredScopes": ["read", "write", "mortgage:read", "ai:agent:read", "admin:read", "admin:write", "admin:delete", "users:read", "users:manage"]
    },
    "Super Banking MCP Gateway": {
      "uri": "mcpgateway.ping.demo",
      "scopes": ["mcp:invoke"],
      "mirroredScopes": ["read", "write", "transfer", "mortgage:read"]
    },
    "Super Banking Agent Gateway": {
      "uri": "agentgateway.ping.demo",
      "scopes": ["agent:invoke"]
    }
  },
  "apps": {
    "Super Banking User App": {
      "type": "WEB_APP",
      "grantTypes": ["authorization_code", "refresh_token", "token_exchange"],
      "grantedScopes": ["ai:agent:read", "read", "write", "transfer", "mortgage:read"]
    },
    "Super Banking Admin App": {
      "type": "WEB_APP",
      "grantTypes": ["authorization_code", "refresh_token", "token_exchange"],
      "grantedScopes": ["read", "write", "transfer", "accounts:read", "transactions:read", "mortgage:read", "ai:agent:read", "ai_agent", "admin:read", "admin:write", "admin:delete", "users:read", "users:manage"]
    },
    "Super Banking MCP Server": {
      "type": "WEB_APP",
      "grantTypes": ["client_credentials"],
      "isResourceServer": "Super Banking MCP Server",
      "grantedScopes": []
    },
    "Super Banking MCP Gateway": {
      "type": "WEB_APP",
      "grantTypes": ["client_credentials", "token_exchange"],
      "isResourceServer": "Super Banking MCP Gateway",
      "grantedScopes": []
    },
    "Super Banking MCP Exchanger": {
      "type": "WEB_APP",
      "grantTypes": ["token_exchange"],
      "grantedScopes": ["read", "write", "mcp:invoke"]
    },
    "Super Banking AI Agent": {
      "type": "WEB_APP",
      "grantTypes": ["client_credentials", "token_exchange"],
      "grantedScopes": ["agent:invoke"]
    },
    "Super Banking Agent": {
      "type": "WORKER",
      "grantTypes": ["client_credentials"],
      "grantedScopes": []
    },
    "Super Banking Worker": {
      "type": "WORKER",
      "grantTypes": ["client_credentials"],
      "grantedScopes": []
    }
  },
  "servers": {
    "demo_api_server": {
      "resource": "Super Banking API",
      "validatesAudience": "enduser.ping.demo",
      "gatesOnToolScopes": false,
      "description": "BFF / token custodian. Performs RFC 8693 two-exchange delegation (user token -> mcpgateway.ping.demo)."
    },
    "demo_mcp_gateway": {
      "resource": "Super Banking MCP Gateway",
      "validatesAudience": "mcpgateway.ping.demo",
      "gatesOnToolScopes": true,
      "description": "MCP Gateway. Validates inbound aud === mcpgateway.ping.demo and enforces per-tool requiredScopes (getScopesForGatewayTool) on the inbound bearer BEFORE credential swap. Therefore every gateway-surface tool scope MUST be mirrored onto the Super Banking MCP Gateway resource (ARCHITECTURE-TRUTHS T-10)."
    },
    "demo_mcp_server": {
      "resource": "Super Banking MCP Server",
      "validatesAudience": "mcpserver.ping.demo",
      "gatesOnToolScopes": true,
      "description": "Backend MCP tool server. Receives the gateway re-exchanged token (aud === mcpserver.ping.demo); banking tool scopes are mirrored here for exchange hop #3."
    },
    "demo_agent_service": {
      "resource": "Super Banking Agent Gateway",
      "validatesAudience": "agentgateway.ping.demo",
      "gatesOnToolScopes": false,
      "description": "Agent Gateway (Two-Exchange Step 1 audience for the AI Agent client-credentials token)."
    }
  },
  "tools": {
    "get_my_accounts":               { "requiredScopes": ["read"], "surface": "gateway" },
    "get_account_balance":           { "requiredScopes": ["read"], "surface": "gateway" },
    "get_my_transactions":           { "requiredScopes": ["read"], "surface": "gateway" },
    "get_sensitive_account_details": { "requiredScopes": ["read"], "surface": "gateway" },
    "sequential_think":              { "requiredScopes": ["read"], "surface": "gateway" },
    "get_investment_balance":        { "requiredScopes": ["read"], "surface": "gateway" },
    "get_investment_accounts":       { "requiredScopes": ["read"], "surface": "gateway" },
    "get_portfolio_summary":         { "requiredScopes": ["read"], "surface": "gateway" },
    "show_mortgage":                 { "requiredScopes": ["mortgage:read"], "surface": "gateway" },
    "create_deposit":                { "requiredScopes": ["write"], "surface": "gateway", "challengeType": "step_up" },
    "create_withdrawal":             { "requiredScopes": ["write"], "surface": "gateway", "challengeType": "step_up" },
    "create_transfer":               { "requiredScopes": ["write", "transfer"], "surface": "gateway", "challengeType": "step_up" },
    "query_user_by_email":           { "requiredScopes": ["ai_agent"], "surface": "exchange-only" },
    "admin_list_all_users":          { "requiredScopes": ["admin:read", "users:read"], "surface": "exchange-only" },
    "admin_get_user_details":        { "requiredScopes": ["admin:read", "users:read"], "surface": "exchange-only" },
    "admin_delete_user":             { "requiredScopes": ["admin:write", "admin:delete", "users:manage"], "surface": "exchange-only" },
    "admin_manage_accounts":         { "requiredScopes": ["admin:write", "users:manage"], "surface": "exchange-only" },
    "admin_view_audit_logs":         { "requiredScopes": ["admin:read"], "surface": "exchange-only" },
    "admin_system_status":           { "requiredScopes": ["admin:read"], "surface": "exchange-only" },
    "lookup_customer":               { "requiredScopes": ["admin:read", "users:read"], "surface": "exchange-only" },
    "get_customer_profile":          { "requiredScopes": ["admin:read", "users:read"], "surface": "exchange-only" },
    "get_customer_accounts":         { "requiredScopes": ["admin:read", "users:read"], "surface": "exchange-only" },
    "get_customer_transactions":     { "requiredScopes": ["admin:read", "users:read"], "surface": "exchange-only" },
    "freeze_account":                { "requiredScopes": ["admin:write", "users:manage"], "surface": "exchange-only" },
    "reset_customer_password":       { "requiredScopes": ["admin:write", "users:manage"], "surface": "exchange-only" },
    "adjust_balance":                { "requiredScopes": ["admin:write", "users:manage"], "surface": "exchange-only" },